<?xml version="1.0" encoding="UTF-8"?>
<tns:patient xmlns:tns="http://www.maheshpathak.com/patient"
	xmlns:xsi="http://www.w3.org/2001/XMLSchema-instance"
	xsi:schemaLocation="http://www.maheshpathak.com/patient patient.xsd "
	xid="34">
	<tns:id>23</tns:id>
	<tns:name>tns:name</tns:name>
	<tns:age>0</tns:age>
	<tns:dob>2001-01-01</tns:dob>
	<tns:email>tns:email</tns:email>
	<tns:gender>M</tns:gender>
	<tns:phone>tns:phone</tns:phone>
	<tns:payment>
		<tns:insurance>
			<tns:provider>kfsdjhksdjf</tns:provider>
			<tns:limit>23</tns:limit>
		</tns:insurance>
	</tns:payment>
</tns:patient>
